{
  "schema_version": 1,
  "matrix_id": "pf001-native-2026.1",
  "story": "PF-001",
  "owner": "release-engineering",
  "procedure_version": "pf001-clean-host-v1",
  "maximum_evidence_age_seconds": 604800,
  "agent_hosts": [
    "claude",
    "codex",
    "cursor",
    "gemini",
    "generic-custom"
  ],
  "cells": [
    {
      "id": "darwin-amd64-macos-tahoe-apfs",
      "owner": "release-engineering-macos",
      "status": "required",
      "operating_system": "darwin",
      "architecture": "amd64",
      "distribution": "macos-tahoe",
      "minimum_os_version": "26.0.0",
      "maximum_os_version": "26.99.99",
      "minimum_build": 25000,
      "maximum_build": 25999,
      "filesystem": "apfs",
      "stock_image": {
        "authority": "apple",
        "source": "https://support.apple.com/guide/mac-help/reinstall-macos-mchlp1599/mac",
        "reset_method": "apple-recovery-erase",
        "identity_kind": "recovery-build-hardware"
      },
      "runner_labels": [
        "amd64",
        "darwin",
        "darwin-amd64-macos-tahoe-apfs",
        "pf001-pristine",
        "self-hosted"
      ],
      "runtime_states": [
        "absent",
        "compatible-running",
        "compatible-stopped"
      ],
      "privilege_expectations": [
        "authorization-services",
        "developer-id",
        "keychain",
        "notarization"
      ],
      "reboot_expectation": "optional",
      "vendor_channel": "stable",
      "offline_redistribution_policy": "user-supplied-official",
      "fixture_suites": [
        "agent-config-preservation",
        "apfs-durability",
        "clean-host-install",
        "default-no-egress",
        "interruption-recovery",
        "managed-runtime-removal",
        "native-publisher",
        "novice-accessibility"
      ]
    },
    {
      "id": "darwin-arm64-macos-tahoe-apfs",
      "owner": "release-engineering-macos",
      "status": "required",
      "operating_system": "darwin",
      "architecture": "arm64",
      "distribution": "macos-tahoe",
      "minimum_os_version": "26.0.0",
      "maximum_os_version": "26.99.99",
      "minimum_build": 25000,
      "maximum_build": 25999,
      "filesystem": "apfs",
      "stock_image": {
        "authority": "apple",
        "source": "https://support.apple.com/en-ca/108900",
        "reset_method": "apple-dfu-restore",
        "identity_kind": "ipsw-build-hardware"
      },
      "runner_labels": [
        "arm64",
        "darwin",
        "darwin-arm64-macos-tahoe-apfs",
        "pf001-pristine",
        "self-hosted"
      ],
      "runtime_states": [
        "absent",
        "compatible-running",
        "compatible-stopped"
      ],
      "privilege_expectations": [
        "authorization-services",
        "developer-id",
        "keychain",
        "notarization"
      ],
      "reboot_expectation": "optional",
      "vendor_channel": "stable",
      "offline_redistribution_policy": "user-supplied-official",
      "fixture_suites": [
        "agent-config-preservation",
        "apfs-durability",
        "clean-host-install",
        "default-no-egress",
        "interruption-recovery",
        "managed-runtime-removal",
        "native-publisher",
        "novice-accessibility"
      ]
    },
    {
      "id": "linux-amd64-fedora-44-xfs",
      "owner": "release-engineering-linux",
      "status": "required",
      "operating_system": "linux",
      "architecture": "amd64",
      "distribution": "fedora-44",
      "minimum_os_version": "44.0",
      "maximum_os_version": "44.99",
      "minimum_build": 44,
      "maximum_build": 44,
      "filesystem": "xfs",
      "stock_image": {
        "authority": "fedora-project",
        "source": "https://fedoraproject.org/workstation/download/",
        "reset_method": "signed-image-reinstall",
        "identity_kind": "sha256-gpg"
      },
      "runner_labels": [
        "amd64",
        "linux",
        "linux-amd64-fedora-44-xfs",
        "pf001-pristine",
        "self-hosted"
      ],
      "runtime_states": [
        "absent",
        "compatible-running",
        "compatible-stopped"
      ],
      "privilege_expectations": [
        "dnf",
        "polkit",
        "rootless",
        "selinux-enforcing",
        "systemd-user"
      ],
      "reboot_expectation": "optional",
      "vendor_channel": "stable",
      "offline_redistribution_policy": "redistributable",
      "fixture_suites": [
        "agent-config-preservation",
        "clean-host-install",
        "default-no-egress",
        "interruption-recovery",
        "managed-runtime-removal",
        "native-package-receipts",
        "novice-accessibility",
        "xfs-durability"
      ]
    },
    {
      "id": "linux-amd64-ubuntu-24.04-ext4",
      "owner": "release-engineering-linux",
      "status": "required",
      "operating_system": "linux",
      "architecture": "amd64",
      "distribution": "ubuntu-24.04",
      "minimum_os_version": "24.04.0",
      "maximum_os_version": "24.04.99",
      "minimum_build": 2404,
      "maximum_build": 2404,
      "filesystem": "ext4",
      "stock_image": {
        "authority": "canonical",
        "source": "https://releases.ubuntu.com/24.04/",
        "reset_method": "signed-image-reinstall",
        "identity_kind": "sha256-gpg"
      },
      "runner_labels": [
        "amd64",
        "linux",
        "linux-amd64-ubuntu-24.04-ext4",
        "pf001-pristine",
        "self-hosted"
      ],
      "runtime_states": [
        "absent",
        "compatible-running",
        "compatible-stopped"
      ],
      "privilege_expectations": [
        "apt",
        "polkit",
        "rootless",
        "systemd-user"
      ],
      "reboot_expectation": "optional",
      "vendor_channel": "stable",
      "offline_redistribution_policy": "redistributable",
      "fixture_suites": [
        "agent-config-preservation",
        "clean-host-install",
        "default-no-egress",
        "ext4-durability",
        "interruption-recovery",
        "managed-runtime-removal",
        "native-package-receipts",
        "novice-accessibility"
      ]
    },
    {
      "id": "linux-arm64-fedora-44-xfs",
      "owner": "release-engineering-linux",
      "status": "required",
      "operating_system": "linux",
      "architecture": "arm64",
      "distribution": "fedora-44",
      "minimum_os_version": "44.0",
      "maximum_os_version": "44.99",
      "minimum_build": 44,
      "maximum_build": 44,
      "filesystem": "xfs",
      "stock_image": {
        "authority": "fedora-project",
        "source": "https://fedoraproject.org/workstation/download/",
        "reset_method": "signed-image-reinstall",
        "identity_kind": "sha256-gpg"
      },
      "runner_labels": [
        "arm64",
        "linux",
        "linux-arm64-fedora-44-xfs",
        "pf001-pristine",
        "self-hosted"
      ],
      "runtime_states": [
        "absent",
        "compatible-running",
        "compatible-stopped"
      ],
      "privilege_expectations": [
        "dnf",
        "polkit",
        "rootless",
        "selinux-enforcing",
        "systemd-user"
      ],
      "reboot_expectation": "optional",
      "vendor_channel": "stable",
      "offline_redistribution_policy": "redistributable",
      "fixture_suites": [
        "agent-config-preservation",
        "clean-host-install",
        "default-no-egress",
        "interruption-recovery",
        "managed-runtime-removal",
        "native-package-receipts",
        "novice-accessibility",
        "xfs-durability"
      ]
    },
    {
      "id": "linux-arm64-ubuntu-24.04-ext4",
      "owner": "release-engineering-linux",
      "status": "required",
      "operating_system": "linux",
      "architecture": "arm64",
      "distribution": "ubuntu-24.04",
      "minimum_os_version": "24.04.0",
      "maximum_os_version": "24.04.99",
      "minimum_build": 2404,
      "maximum_build": 2404,
      "filesystem": "ext4",
      "stock_image": {
        "authority": "canonical",
        "source": "https://cdimage.ubuntu.com/releases/24.04/release/",
        "reset_method": "signed-image-reinstall",
        "identity_kind": "sha256-gpg"
      },
      "runner_labels": [
        "arm64",
        "linux",
        "linux-arm64-ubuntu-24.04-ext4",
        "pf001-pristine",
        "self-hosted"
      ],
      "runtime_states": [
        "absent",
        "compatible-running",
        "compatible-stopped"
      ],
      "privilege_expectations": [
        "apt",
        "polkit",
        "rootless",
        "systemd-user"
      ],
      "reboot_expectation": "optional",
      "vendor_channel": "stable",
      "offline_redistribution_policy": "redistributable",
      "fixture_suites": [
        "agent-config-preservation",
        "clean-host-install",
        "default-no-egress",
        "ext4-durability",
        "interruption-recovery",
        "managed-runtime-removal",
        "native-package-receipts",
        "novice-accessibility"
      ]
    },
    {
      "id": "windows-amd64-11-25h2-ntfs",
      "owner": "release-engineering-windows",
      "status": "required",
      "operating_system": "windows",
      "architecture": "amd64",
      "distribution": "windows-11-25h2",
      "minimum_os_version": "10.0.26200",
      "maximum_os_version": "10.0.26299",
      "minimum_build": 26200,
      "maximum_build": 26299,
      "filesystem": "ntfs",
      "stock_image": {
        "authority": "microsoft",
        "source": "https://www.microsoft.com/software-download/windows11",
        "reset_method": "signed-image-reinstall",
        "identity_kind": "sha256-authenticode"
      },
      "runner_labels": [
        "amd64",
        "pf001-pristine",
        "self-hosted",
        "windows",
        "windows-amd64-11-25h2-ntfs"
      ],
      "runtime_states": [
        "absent",
        "compatible-running",
        "compatible-stopped"
      ],
      "privilege_expectations": [
        "authenticode",